URL,Version,Status,OIDs,Name,Title,Descriptino,Used
http://dicom.nema.org/resources/ontology/DCM,01,active,"1.2.840.10008.2.16.4",DICOM Controlled Terminology Definitions,null,"DICOM Code Definitions (Coding Scheme Designator ""DCM"" Coding Scheme Version ""01"")","ValueSet/security-role-type,ValueSet/dicom-cid-29-AcquisitionModality"
http://hl7.org/fhir/action-cardinality-behavior,4.0.1,draft,"2.16.840.1.113883.4.642.4.808",ActionCardinalityBehavior,ActionCardinalityBehavior,"Defines behavior for an action or a group for how many times that item may be repeated.","ValueSet/action-cardinality-behavior"
http://hl7.org/fhir/action-condition-kind,4.0.1,draft,"2.16.840.1.113883.4.642.4.816",ActionConditionKind,ActionConditionKind,"Defines the kinds of conditions that can appear on actions.","ValueSet/action-condition-kind"
http://hl7.org/fhir/action-grouping-behavior,4.0.1,draft,"2.16.840.1.113883.4.642.4.800",ActionGroupingBehavior,ActionGroupingBehavior,"Defines organization behavior of a group.","ValueSet/action-grouping-behavior"
http://hl7.org/fhir/action-participant-type,4.0.1,draft,"2.16.840.1.113883.4.642.4.812",ActionParticipantType,ActionParticipantType,"The type of participant for the action.","ValueSet/action-participant-type"
http://hl7.org/fhir/action-precheck-behavior,4.0.1,draft,"2.16.840.1.113883.4.642.4.806",ActionPrecheckBehavior,ActionPrecheckBehavior,"Defines selection frequency behavior for an action or group.","ValueSet/action-precheck-behavior"
http://hl7.org/fhir/action-relationship-type,4.0.1,draft,"2.16.840.1.113883.4.642.4.814",ActionRelationshipType,ActionRelationshipType,"Defines the types of relationships between actions.","ValueSet/action-relationship-type"
http://hl7.org/fhir/action-required-behavior,4.0.1,draft,"2.16.840.1.113883.4.642.4.804",ActionRequiredBehavior,ActionRequiredBehavior,"Defines expectations around whether an action or action group is required.","ValueSet/action-required-behavior"
http://hl7.org/fhir/action-selection-behavior,4.0.1,draft,"2.16.840.1.113883.4.642.4.802",ActionSelectionBehavior,ActionSelectionBehavior,"Defines selection behavior of a group.","ValueSet/action-selection-behavior"
http://hl7.org/fhir/address-type,4.0.1,active,"2.16.840.1.113883.4.642.4.70",AddressType,AddressType,"The type of an address (physical / postal).","ValueSet/address-type"
http://hl7.org/fhir/address-use,4.0.1,active,"2.16.840.1.113883.4.642.4.68",AddressUse,AddressUse,"The use of an address.","ValueSet/address-use"
http://hl7.org/fhir/administrative-gender,4.0.1,active,"2.16.840.1.113883.4.642.4.2",AdministrativeGender,AdministrativeGender,"The gender of a person used for administrative purposes.","ValueSet/administrative-gender"
http://hl7.org/fhir/consent-data-meaning,4.0.1,draft,"2.16.840.1.113883.4.642.4.760",ConsentDataMeaning,ConsentDataMeaning,"How a resource reference is interpreted when testing consent restrictions.","ValueSet/consent-data-meaning"
http://hl7.org/fhir/consent-provision-type,4.0.1,draft,"2.16.840.1.113883.4.642.4.758",ConsentProvisionType,ConsentProvisionType,"How a rule statement is applied, such as adding additional consent or removing consent.","ValueSet/consent-provision-type"
http://hl7.org/fhir/consent-state-codes,4.0.1,draft,"2.16.840.1.113883.4.642.4.756",ConsentState,ConsentState,"Indicates the state of the consent.","ValueSet/consent-state-codes"
http://hl7.org/fhir/contact-point-system,4.0.1,active,"2.16.840.1.113883.4.642.4.72",ContactPointSystem,ContactPointSystem,"Telecommunications form for contact point.","ValueSet/contact-point-system"
http://hl7.org/fhir/contact-point-use,4.0.1,active,"2.16.840.1.113883.4.642.4.74",ContactPointUse,ContactPointUse,"Use of contact point.","ValueSet/contact-point-use"
http://hl7.org/fhir/device-nametype,4.0.1,draft,"2.16.840.1.113883.4.642.4.1084",DeviceNameType,DeviceNameType,"The type of name the device is referred by.","ValueSet/device-nametype"
http://hl7.org/fhir/device-status,4.0.1,draft,"2.16.840.1.113883.4.642.4.210",FHIRDeviceStatus,FHIRDeviceStatus,"The availability status of the device.","ValueSet/device-status"
http://hl7.org/fhir/encounter-location-status,4.0.1,draft,"2.16.840.1.113883.4.642.4.263",EncounterLocationStatus,EncounterLocationStatus,"The status of the location.","ValueSet/encounter-location-status"
http://hl7.org/fhir/encounter-status,4.0.1,draft,"2.16.840.1.113883.4.642.4.247",EncounterStatus,EncounterStatus,"Current state of the encounter.","ValueSet/encounter-status"
http://hl7.org/fhir/event-status,4.0.1,draft,"2.16.840.1.113883.4.642.4.110",EventStatus,EventStatus,"Codes identifying the lifecycle stage of an event.","ValueSet/event-status"
http://hl7.org/fhir/identifier-use,4.0.1,active,"2.16.840.1.113883.4.642.4.58",IdentifierUse,IdentifierUse,"Identifies the purpose for this identifier, if known .","ValueSet/identifier-use"
http://hl7.org/fhir/imagingstudy-status,4.0.1,draft,"2.16.840.1.113883.4.642.4.991",ImagingStudyStatus,ImagingStudyStatus,"The status of the ImagingStudy.","ValueSet/imagingstudy-status"
http://hl7.org/fhir/item-type,4.0.1,draft,"2.16.840.1.113883.4.642.4.445",QuestionnaireItemType,QuestionnaireItemType,"Distinguishes groups from questions and display text and indicates data type for questions.","ValueSet/item-type"
http://hl7.org/fhir/link-type,4.0.1,active,"2.16.840.1.113883.4.642.4.424",LinkType,LinkType,"The type of link between this patient resource and another patient resource.","ValueSet/link-type"
http://hl7.org/fhir/name-use,4.0.1,active,"2.16.840.1.113883.4.642.4.66",NameUse,NameUse,"The use of a human name.","ValueSet/name-use"
http://hl7.org/fhir/observation-status,4.0.1,active,"2.16.840.1.113883.4.642.4.401",ObservationStatus,ObservationStatus,"Codes providing the status of an observation.","ValueSet/observation-status"
http://hl7.org/fhir/publication-status,4.0.1,active,"2.16.840.1.113883.4.642.4.4",PublicationStatus,PublicationStatus,"The lifecycle status of an artifact.","ValueSet/publication-status"
http://hl7.org/fhir/quantity-comparator,4.0.1,active,"2.16.840.1.113883.4.642.4.60",QuantityComparator,QuantityComparator,"How the Quantity should be understood and represented.","ValueSet/quantity-comparator"
http://hl7.org/fhir/questionnaire-answers-status,4.0.1,draft,"2.16.840.1.113883.4.642.4.448",QuestionnaireResponseStatus,QuestionnaireResponseStatus,"Lifecycle status of the questionnaire response.","ValueSet/questionnaire-answers-status"
http://hl7.org/fhir/questionnaire-enable-behavior,4.0.1,draft,"2.16.840.1.113883.4.642.4.1008",EnableWhenBehavior,EnableWhenBehavior,"Controls how multiple enableWhen values are interpreted -  whether all or any must be true.","ValueSet/questionnaire-enable-behavior"
http://hl7.org/fhir/questionnaire-enable-operator,4.0.1,draft,"2.16.840.1.113883.4.642.4.1006",QuestionnaireItemOperator,QuestionnaireItemOperator,"The criteria by which a question is enabled.","ValueSet/questionnaire-enable-operator"
http://hl7.org/fhir/request-priority,4.0.1,draft,"2.16.840.1.113883.4.642.4.116",RequestPriority,RequestPriority,"Identifies the level of importance to be assigned to actioning the request.","ValueSet/request-priority"
http://hl7.org/fhir/resource-types,4.0.1,active,,ResourceType,ResourceType,"One of the resource types defined as part of this version of FHIR.","ValueSet/subject-type,ValueSet/consent-content-class,ValueSet/resource-types"
http://hl7.org/fhir/sid/icd-10-cm,2.0.1,active,"2.16.840.1.113883.6.90",Icd10CM,International Classification of Diseases, 10th Revision, Clinical Modification (ICD-10-CM),"The International Classification of Diseases, 10th Revision, Clinical Modification (ICD-10-CM), describes the classification of morbidity and mortality information for statistical purposes and for the indexing of healthcare records by diseases. The ICD-10-CM codes can be used as the value of the Act.cd attribute.","ValueSet/us-core-condition-code"
http://hl7.org/fhir/udi-entry-type,4.0.1,draft,"2.16.840.1.113883.4.642.4.212",UDIEntryType,UDIEntryType,"Codes to identify how UDI data was entered.","ValueSet/udi-entry-type"
http://loinc.org,3.1.0,active,"2.16.840.1.113883.6.1",LOINC,Logical Observation Identifiers, Names and Codes (LOINC),"LOINC provides a set of universal names and ID codes for identifying laboratory and clinical test results.1,2 LOINC facilitates the exchange and pooling of results, such as blood hemoglobin, serum potassium, or vital signs, for clinical care, outcomes management, and research. LOINC's universal identifiers (names and codes) can be used in the context of order and observation exchanges between information systems that use syntax standards such as HL73, CEN TC251, ISO TC215, ASTM4, and DICOM. Specifically, the identifier can be used as the coded value for an observation in any other standard that uses the observation/observation value paradigm, whether messages, documents, application programming interface (API), etc. For example, LOINC codes are used widely in the OBX segment Observation Identifier field (OBX-3) of an ORU HL7 (HL7 version 2.x or ASTM 1238-9410) message that may be sent between a Clinical Laboratory Information Management Systems (LIMS) and Electronic Health Record Systems (EHR).5, 6 In this way, LOINC codes provide universal identifiers that allow the exchange of clinical data between heterogeneous computing environments.","ValueSet/us-core-vital-signs,ValueSet/questionnaire-questions,ValueSet/observation-codes,ValueSet/consent-content-code,ValueSet/consent-category"
http://snomed.info/sct,null,active,"2.16.840.1.113883.6.96",SNOMED_CT,SNOMED CT (all versions),"SNOMED CT is the most comprehensive and precise clinical health terminology product in the world, owned and distributed around the world by The International Health Terminology Standards Development Organisation (IHTSDO).","ValueSet/device-type,ValueSet/bodysite-laterality,ValueSet/clinical-findings,ValueSet/condition-stage,ValueSet/us-core-encounter-type,ValueSet/referencerange-appliesto,ValueSet/encounter-reason,ValueSet/procedure-reason,ValueSet/condition-code,ValueSet/media-view,ValueSet/condition-stage-type,ValueSet/us-core-condition-code,ValueSet/observation-methods,ValueSet/body-site,ValueSet/questionnaire-answers,ValueSet/manifestation-or-symptom,ValueSet/goal-start-event,ValueSet/condition-severity"
http://terminology.hl7.org/CodeSystem/action-type,0.1.0,draft,"2.16.840.1.113883.4.642.1.1246",ActionType,ActionType,"The type of action to be performed.","ValueSet/action-type"
http://terminology.hl7.org/CodeSystem/admit-source,0.1.0,draft,"2.16.840.1.113883.4.642.1.1092",AdmitSource,Admit source,"This value set defines a set of codes that can be used to indicate from where the patient came in.","ValueSet/encounter-admit-source"
http://terminology.hl7.org/CodeSystem/condition-category,0.5.0,draft,"2.16.840.1.113883.4.642.1.1073",ConditionCategoryCodes,Condition Category Codes,"Preferred value set for Condition Categories.","ValueSet/condition-category"
http://terminology.hl7.org/CodeSystem/condition-clinical,2.0.0,active,"2.16.840.1.113883.4.642.1.1074",ConditionClinicalStatusCodes,Condition Clinical Status Codes,"Preferred value set for Condition Clinical Status.","ValueSet/condition-clinical"
http://terminology.hl7.org/CodeSystem/condition-ver-status,1.0.0,draft,"2.16.840.1.113883.4.642.1.1075",ConditionVerificationStatus,ConditionVerificationStatus,"The verification status to support or decline the clinical status of the condition or diagnosis.","ValueSet/condition-ver-status"
http://terminology.hl7.org/CodeSystem/consentaction,0.1.0,draft,"2.16.840.1.113883.4.642.1.1227",ConsentActionCodes,Consent Action Codes,"This value set includes sample Consent Action codes.","ValueSet/consent-action"
http://terminology.hl7.org/CodeSystem/consentcategorycodes,0.1.0,draft,"2.16.840.1.113883.4.642.1.1226",ConsentCategoryCodes,Consent Category Codes,"This value set includes sample Consent Directive Type codes, including several consent directive related LOINC codes; HL7 VALUE SET: ActConsentType(2.16.840.1.113883.1.11.19897); examples of US realm consent directive legal descriptions and references to online and/or downloadable forms such as the SSA-827 Authorization to Disclose Information to the Social Security Administration; and other anticipated consent directives related to participation in a clinical trial, medical procedures, reproductive procedures; health care directive (Living Will); advance directive, do not resuscitate (DNR); Physician Orders for Life-Sustaining Treatment (POLST)","ValueSet/consent-category"
http://terminology.hl7.org/CodeSystem/consentpolicycodes,2.0.0,draft,"2.16.840.1.113883.4.642.1.1229",ConsentPolicyRuleCodes,Consent PolicyRule Codes,"This value set includes sample Regulatory consent policy types from the US and other regions.","ValueSet/consent-policy"
http://terminology.hl7.org/CodeSystem/consentscope,0.1.0,draft,"2.16.840.1.113883.4.642.1.1228",ConsentScopeCodes,Consent Scope Codes,"This value set includes the four Consent scope codes.","ValueSet/consent-scope"
http://terminology.hl7.org/CodeSystem/contractsignertypecodes,0.1.0,draft,"2.16.840.1.113883.4.642.1.1201",ContractSignerTypeCodes,Contract Signer Type Codes,"This value set includes sample Contract Signer Type codes.","ValueSet/security-role-type"
http://terminology.hl7.org/CodeSystem/data-absent-reason,0.1.0,active,"2.16.840.1.113883.4.642.4.1048",DataAbsentReason,DataAbsentReason,"Used to specify why the normally expected content of the data element is missing.","ValueSet/data-absent-reason"
http://terminology.hl7.org/CodeSystem/definition-topic,0.1.0,draft,"2.16.840.1.113883.4.642.1.1244",DefinitionTopic,DefinitionTopic,"High-level categorization of the definition, used for searching, sorting, and filtering.","ValueSet/definition-topic"
http://terminology.hl7.org/CodeSystem/device-status-reason,0.1.0,draft,"2.16.840.1.113883.4.642.1.1082",FHIRDeviceStatusReason,FHIRDeviceStatusReason,"The availability status reason of the device.","ValueSet/device-status-reason"
http://terminology.hl7.org/CodeSystem/diagnosis-role,0.1.1,draft,"2.16.840.1.113883.4.642.1.1054",DiagnosisRole,Diagnosis Role,"This value set defines a set of codes that can be used to express the role of a diagnosis on the Encounter or EpisodeOfCare record.","ValueSet/diagnosis-role"
http://terminology.hl7.org/CodeSystem/diet,0.1.0,draft,"2.16.840.1.113883.4.642.1.1091",Diet,Diet,"This value set defines a set of codes that can be used to indicate dietary preferences or restrictions a patient may have.","ValueSet/encounter-diet"
http://terminology.hl7.org/CodeSystem/encounter-special-arrangements,0.1.0,draft,"2.16.840.1.113883.4.642.1.1090",SpecialArrangements,Special arrangements,"This value set defines a set of codes that can be used to indicate the kinds of special arrangements in place for a patients visit.","ValueSet/encounter-special-arrangements"
http://terminology.hl7.org/CodeSystem/extra-security-role-type,0.2.0,draft,,SecurityRoleType,Security Role Type,"This CodeSystem contains Additional FHIR-defined Security Role types not defined elsewhere","ValueSet/security-role-type"
http://terminology.hl7.org/CodeSystem/goal-category,0.1.0,draft,"2.16.840.1.113883.4.642.1.1097",GoalCategory,Goal category,"Example codes for grouping goals to use for filtering or presentation.","ValueSet/goal-category"
http://terminology.hl7.org/CodeSystem/goal-priority,0.1.0,draft,"2.16.840.1.113883.4.642.1.1096",GoalPriority,Goal priority,"Indicates the level of importance associated with reaching or sustaining a goal.","ValueSet/goal-priority"
http://terminology.hl7.org/CodeSystem/location-physical-type,1.0.0,draft,"2.16.840.1.113883.4.642.1.1108",LocationType,Location type,"This example value set defines a set of codes that can be used to indicate the physical form of the Location.  This includes several 'non physical' codes which are still considered a location.","ValueSet/location-physical-type"
http://terminology.hl7.org/CodeSystem/media-modality,4.0.1,draft,"2.16.840.1.113883.4.642.4.1109",MediaModality,Media Modality,"Detailed information about the type of the image - its kind, purpose, or the kind of equipment used to generate it.","ValueSet/media-modality"
http://terminology.hl7.org/CodeSystem/media-type,4.0.1,draft,"2.16.840.1.113883.4.642.1.326",MediaType,Media Type,"Codes for high level media categories.","ValueSet/media-type"
http://terminology.hl7.org/CodeSystem/observation-category,0.1.0,draft,"2.16.840.1.113883.4.642.1.1125",ObservationCategoryCodes,Observation Category Codes,"Observation Category codes.","ValueSet/observation-category"
http://terminology.hl7.org/CodeSystem/participant-type,0.5.0,draft,"2.16.840.1.113883.4.642.1.1089",ParticipantType,Participant type,"This value set defines a set of codes that can be used to indicate how an individual participates in an encounter.","ValueSet/encounter-participant-type"
http://terminology.hl7.org/CodeSystem/plan-definition-type,0.1.0,draft,"2.16.840.1.113883.4.642.1.1245",PlanDefinitionType,PlanDefinitionType,"The type of PlanDefinition.","ValueSet/plan-definition-type"
http://terminology.hl7.org/CodeSystem/referencerange-meaning,0.1.0,draft,"2.16.840.1.113883.4.642.1.1124",ObservationReferenceRangeMeaningCodes,Observation Reference Range Meaning Codes,"This value set defines a set of codes that can be used to indicate the meaning/use of a reference range for a particular target population.","ValueSet/referencerange-meaning"
http://terminology.hl7.org/CodeSystem/service-type,0.1.0,draft,"2.16.840.1.113883.4.642.1.1145",ServiceType,Service type,"This value set defines an example set of codes of service-types.","ValueSet/service-type"
http://terminology.hl7.org/CodeSystem/v2-0092,2.1.0,active,"2.16.840.1.113883.18.36",ReAdmissionIndicator,re-admissionIndicator,"Code system of concepts which are used to specify that a patient is being re admitted to a healthcare facilityin from which they were discharged, and indicates the circumstances around such re-admission.  Used in HL7 Version 2.x messagine in the PV1 segment.","ValueSet/v2-0092"
http://terminology.hl7.org/CodeSystem/v2-0131,2.1.0,active,"2.16.840.1.113883.18.58",ContactRole2,contactRole2,"Code system of concepts which specify a relationship role that the next of kin/associated parties plays with regard to the patient. Also used in referrals, for example, it may be necessary to identify the contact representative at the clinic that sent a referral. Used in HL7 Version 2 messaging in the NK1 and CTD segments after 2.5, when it replace 2.16.840.1.113883.18.57.","ValueSet/patient-contactrelationship"
http://terminology.hl7.org/CodeSystem/v2-0203,3.0.0,active,"2.16.840.1.113883.18.108",IdentifierType,identifierType,"HL7-defined code system of concepts specifying type of identifier. Used in HL7 Version 2.x messaging data types CX, PLN, PPN, XCN and XON.","ValueSet/identifier-type"
http://terminology.hl7.org/CodeSystem/v3-ActCode,8.0.1,active,"2.16.840.1.113883.5.4",ActCode,ActCode,"A code specifying the particular kind of Act that the Act-instance represents within its class.    *Constraints:* The kind of Act (e.g. physical examination, serum potassium, inpatient encounter, charge financial transaction, etc.) is specified with a code from one of several, typically external, coding systems. The coding system will depend on the class of Act, such as LOINC for observations, etc.    Conceptually, the Act.code must be a specialization of the Act.classCode. This is why the structure of ActClass domain should be reflected in the superstructure of the ActCode domain and then individual codes or externally referenced vocabularies subordinated under these domains that reflect the ActClass structure.    Act.classCode and Act.code are not modifiers of each other but the Act.code concept should really imply the Act.classCode concept. For a negative example, it is not appropriate to use an Act.code ""potassium"" together with and Act.classCode for ""laboratory observation"" to somehow mean ""potassium laboratory observation"" and then use the same Act.code for ""potassium"" together with Act.classCode for ""medication"" to mean ""substitution of potassium"". This mutually modifying use of Act.code and Act.classCode is not permitted.","ValueSet/v3-ActEncounterCode"
http://terminology.hl7.org/CodeSystem/v3-ActPriority,2.1.0,active,"2.16.840.1.113883.5.7",ActPriority,ActPriority,"A set of codes (e.g., for routine, emergency), specifying the urgency under which the Act happened, can happen, is happening, is intended to happen, or is requested/demanded to happen.","ValueSet/v3-ActPriority"
http://terminology.hl7.org/CodeSystem/v3-ActReason,2.1.1,active,"2.16.840.1.113883.5.8",ActReason,ActReason,"A set of codes specifying the motivation, cause, or rationale of an Act, when such rationale is not reasonably represented as an ActRelationship of type ""has reason"" linking to another Act.    *Examples:* Example reasons that might qualify for being coded in this field might be: ""routine requirement"", ""infectious disease reporting requirement"", ""on patient request"", ""required by law"".","ValueSet/v3-PurposeOfUse"
http://terminology.hl7.org/CodeSystem/v3-EncounterSpecialCourtesy,2.1.0,active,"2.16.840.1.113883.5.40",EncounterSpecialCourtesy,EncounterSpecialCourtesy,"**** MISSING DESCRIPTION ****","ValueSet/encounter-special-courtesy"
http://terminology.hl7.org/CodeSystem/v3-MaritalStatus,2.1.0,active,"2.16.840.1.113883.5.2",MaritalStatus,MaritalStatus,"\* \* \* No description supplied \* \* \*    *Open Issue:* The specific meanings of these codes can vary somewhat by jurisdiction and implementation so caution should be used when determining equivalency.    *Open Issue:* fixing and completion of the hierarchy and proper good definitions of all the concepts is badly needed.","ValueSet/marital-status"
http://terminology.hl7.org/CodeSystem/v3-NullFlavor,2.1.0,active,"2.16.840.1.113883.5.1008",NullFlavor,NullFlavor,"A collection of codes specifying why a valid value is not present.","ValueSet/marital-status,ValueSet/encounter-special-courtesy"
http://terminology.hl7.org/CodeSystem/v3-ObservationInterpretation,2.1.0,active,"2.16.840.1.113883.5.83",ObservationInterpretation,ObservationInterpretation,"One or more codes providing a rough qualitative interpretation of the observation, such as ""normal"" / ""abnormal"", ""low"" / ""high"", ""better"" / ""worse"", ""resistant"" / ""susceptible"", ""expected"" / ""not expected"". The value set is intended to be for ANY use where coded representation of an interpretation is needed.","ValueSet/observation-interpretation"
http://terminology.hl7.org/CodeSystem/v3-ParticipationFunction,2.1.0,active,"2.16.840.1.113883.5.88",ParticipationFunction,ParticipationFunction,"This code is used to specify the exact function an actor had in a service in all necessary detail. This domain may include local extensions (CWE).","ValueSet/security-role-type"
http://terminology.hl7.org/CodeSystem/v3-ParticipationType,4.0.0,active,"2.16.840.1.113883.5.90",ParticipationType,ParticipationType,"A code specifying the meaning and purpose of every Participation instance. Each of its values implies specific constraints on the Roles undertaking the participation.","ValueSet/series-performer-function,ValueSet/security-role-type,ValueSet/encounter-participant-type"
http://terminology.hl7.org/CodeSystem/v3-RoleClass,3.1.0,active,"2.16.840.1.113883.5.110",RoleClass,RoleClass,"Codes for the Role class hierarchy. The values in this hierarchy, represent a Role which is an association or relationship between two entities - the entity that plays the role and the entity that scopes the role. Roles names are derived from the name of the playing entity in that role.    The role hierarchy stems from three core concepts, or abstract domains:     *  **RoleClassOntological** is an abstract domain that collects roles in which the playing entity is defined or specified by the scoping entity.   *  **RoleClassPartitive** collects roles in which the playing entity is in some sense a ""part"" of the scoping entity.   *  **RoleClassAssociative** collects all of the remaining forms of association between the playing entity and the scoping entity. This set of roles is further partitioned between:             *  **RoleClassPassive** which are roles in which the playing entity is used, known, treated, handled, built, or destroyed, etc. under the auspices of the scoping entity. The playing entity is passive in these roles in that the role exists without an agreement from the playing entity.       *  **RoleClassMutualRelationship** which are relationships based on mutual behavior of the two entities. The basis of these relationship may be formal agreements or they may be *de facto* behavior. Thus, this sub-domain is further divided into:                     *  **RoleClassRelationshipFormal** in which the relationship is formally defined, frequently by a contract or agreement.           *  **Personal relationship** which inks two people in a personal relationship.    The hierarchy discussed above is represented In the current vocabulary tables as a set of abstract domains, with the exception of the ""Personal relationship"" which is a leaf concept.    *OpenIssue:* Description copied from Concept Domain of same name. Must be verified.","ValueSet/security-role-type"
http://terminology.hl7.org/CodeSystem/v3-RoleCode,2.2.0,active,"2.16.840.1.113883.5.111",RoleCode,RoleCode,"A set of codes further specifying the kind of Role; specific classification codes for further qualifying RoleClass codes.","ValueSet/security-role-type"
